{
  "schema_version": "1.0",
  "stream_id": "STREAM_STATIONARY_02",
  "stream_type": "stationary",
  "memory_reset_group": "RESET_STATIONARY_02",
  "episodes": [
    {
      "episode_index": 0,
      "scenario_id": "SCN_0064",
      "policy_version": "P1",
      "instruction": "重物应尽量靠近托盘底面中心。"
    },
    {
      "episode_index": 1,
      "scenario_id": "SCN_0065",
      "policy_version": "P1",
      "instruction": "重物应尽量靠近托盘底面中心。"
    },
    {
      "episode_index": 2,
      "scenario_id": "SCN_0066",
      "policy_version": "P1",
      "instruction": "重物应尽量靠近托盘底面中心。"
    },
    {
      "episode_index": 3,
      "scenario_id": "SCN_0067",
      "policy_version": "P1",
      "instruction": "重物应尽量靠近托盘底面中心。"
    },
    {
      "episode_index": 4,
      "scenario_id": "SCN_0068",
      "policy_version": "P1",
      "instruction": "重物应尽量靠近托盘底面中心。"
    },
    {
      "episode_index": 5,
      "scenario_id": "SCN_0069",
      "policy_version": "P1",
      "instruction": "重物应尽量靠近托盘底面中心。"
    },
    {
      "episode_index": 6,
      "scenario_id": "SCN_0070",
      "policy_version": "P1",
      "instruction": "重物应尽量靠近托盘底面中心。"
    },
    {
      "episode_index": 7,
      "scenario_id": "SCN_0071",
      "policy_version": "P1",
      "instruction": "重物应尽量靠近托盘底面中心。"
    },
    {
      "episode_index": 8,
      "scenario_id": "SCN_0072",
      "policy_version": "P1",
      "instruction": "重物应尽量靠近托盘底面中心。"
    },
    {
      "episode_index": 9,
      "scenario_id": "SCN_0073",
      "policy_version": "P1",
      "instruction": "重物应尽量靠近托盘底面中心。"
    }
  ]
}
